,Country,Description,Name,Points,Price,Province,Variety,Winery,Region
781,,"Pretty Aromas Of Violet, Rose And Wild Berry Lead The Nose. The Bright But Rather Lean Palate Offers Raw Red Berry, Peppercorn And Saline Together With Notes Of Dried Sage. Astringent Tannins Create An Abrupt Finish.",Tradizione,,87.0,,,Tenuta Vitanza,
782,,"Aromas Are Dominated By Oak With Accents Of Vanilla, Cocoa And Woodspice Along With Cranberries, Rose Hips, Herbs And Raspberries. The Palate Is Elegant With Herb And Cherry Flavors That Lead To A Tart, Cranberry-filled Finish.",Copeland Vineayard,,,,,Two Mountain,
783,,"Warm And Robust, This Has Aromas Of Underbrush, Spiced Plum, Grilled Sage, Leather And A Balsamic Note. The Tightly Wound Palate Offers Dried Berry, Fig, Menthol And Licorice Alongside Super-astringent Tannins And The Heat Of Alcohol. A Note Of Roasted Coffee Bean Signals The Close.",Firma Riserva,,,,,,
784,,"Though Just Five Years Old, This Blend Of Cabernet Sauvignon, Petit Verdot And Merlot Already Seems Quite Tired, With Notes Of Leather, Dried Red Fruit And Mushroom Taking The Lead. It Has A Pleasing, Silky Feel But The Tart Fruit Flavors Seem Past Their Prime.",Intrepide,,,,,Ott & Murphy,
785,,"Big, Fresh And Juicy, This Is A Bright And Forward Wine. Attractive Smoky Tannins Are Layered With Fresh Acidity And Black Currant Flavors. The Wine Is Already Attractive, Although There Are Enough Tannins For It To Age. Drink From 2017.",,,,,,Château Gazin Rocquencourt,
786,,"This Wine Is All Fruit, Crisp And With Plenty Of Herbaceousness. A Smoother Character Comes From The Sémillon In The Blend That Also Gives Richness. The Wood Aging Shows Only Lightly, Leaving Fruitiness At The End.",,,,,,,
787,,"Produced From Young Vines, This Is The Third Wine Of Larrivet Haut-brion. As Such, It Is Very Accessible With Its Ripe, Red Exuberant Fruits. The Tannins Are In The Background, Giving The Necessary Structure To A Wine That Will Age Quickly. Drink From 2017.",Les Hauts De Larrivet Haut-brion,,,,,Château Larrivet Haut-brion,
788,,"The Dryness And Tannins Of This Wine Are On The Outside. Inside It Has Plenty Of Juicy Fruit, Sweet Acidity And Black Plum Flavors. Put The Two Together And This Ripe Wine Offers Plenty Of Potential. Drink From 2019.",,,,,,Château Luchey-halde,
789,,"Hugely Ripe Merlot Is At The Core Of This Rich Wine. It Is Opulent, Rounded And Packed With Dark Plum-juice Flavors. It Verges On Too Much, Too Rich And Too Generous. What Redeems It Is The Bordeaux Structure And Final Dry Aftertaste.",Dame De Coeur,,,,,Château Peyfaures,Bordeaux Supérieur
790,,"Nearly Equal Parts Cabernet Sauvignon, Cabernet Franc And Merlot, This Wine Is Perfumed In Lavender And Awash In Juicy Red Cassis. The Acidity Is Medium To High, While The Tannins Are Rough And Chewy, Suggesting The Need For Assimilation Time.",Serres Ranch,,,,,Highway 12,
791,,"The Nose Isn't Very Expressive, But The Palate Offers Mature Blackberry, Dried Cherry, Ground Pepper, Espresso And Anise Alonside Assertive, Astringent Tannins. The Dried Fruit Shows The Heat Of The Vintage So Best To Drink Soon.",Greppicante,,,,,I Greppi,
792,,"Oodles Of Black Cherry And Boysenberry Fill The Aromas And Flavors Of This Bold But Not-too-big Wine. The Rich, Ripe Fruit Shows Right Away In The Nose, And Continues On The Palate But Gets Reined In A Bit (in A Good Way) By A Firm Texture Created By Good Acidity And Tannins.",,,,,,Drytown,
793,,"Extremely Fruity And Rich, This Stops Just Short Of Sweetness While Delivering Delicious Cherry, Mixed Berry And Plum Flavors With Just A Touch Of Tannin And Acidity To Keep It Fresh. It Is Quite Full Bodied And Ready To Drink Now.",Syzygy,,,,,Entropy Cellars,
794,,"This 100% Varietal Wine Offers Aromas Of Fresh-ground Coffee, Chocolate, Herbs And Plum Along With Barrel Accents. It's Soft In Feel With An Elegant Styling, Trailing Toward The Finish.",Canoe Ridge Vineyard,,,,,,
795,,"The 60% Cabernet In The Blend Gives A Dark Fruit Character. At This Young Stage, The Wood Aging Still Dominates With Its Burnt Toast And Chocolate Character. For The Future, While The Wine Will Be Dry, It Also Has Plenty Of Fresh Fruit. Drink From 2018.",,,,,,Château Taffard De Blaignan,
796,,This Single-vineyard Wine Offers Wild Blueberry With Vanilla And Herb Accents. It's Full Bodied And High-octane In Feel With The Flavors Running Straight Down The Fairway.,Cockburn Ranch Vineyard,,,,,College Cellars,
797,,"Grass And Gooseberry Are Prominent On The Nose And Palate In This Crisp Sb, Bright In Dialed-high Acidity. That Sense Of Vibrant Freshness Mellows Somewhat Midway Through The Wine, Allowing It To Finish With A Lushness On The Tongue.",,,,,,Coquerel Family Wine Estates,Calistoga
798,,"Generous Sweet-tasting Oak Flavor Coats The Fresh Plum And Red Cherry Flavors In This Medium-bodied Wine. It Has A Broad, Velvety Texture, And Shows Good Balance Between Ripeness, Acidity And Firm Tannins. It Finishes With A Soft Touch.",Bogle Vineyards,,,,,Bogle,
799,,"This Wine Hails From Lawrence And Antoine Creek Vineyards And Was Barrel-fermented In New French Oak Before Being Moved To Stainless Steel. It Starts Out Quite Reduced And Then Opens To Show Notes Of Peach, Pear And Mineral. It's Rounded And Lightly Oily In Feel, Tapering On The Back Half.",Reserve Nellie Mae,,,,,,
800,,"Tech Sheets Hint At Stagecoach Vineyard Being Involved Somehow In This Syrah, A Chewy Expression Of Coconut, Smoke And Game Around A Dense, Concentrated Body And Well-integrated Tannins. The Finish Is All About Mocha.",Lot 423,,,,,,
801,,"Predominantly Syrah (80%) With Petite Sirah And Viognier, This Wine Conveys Raspberries, Cherries, Flowers, Black Pepper And Dark Coffee. It's Lighter In Style With Lip-smacking Fruit And Barrel Flavors.",Amatino,,,,,Fujishin,
802,,"Half Malbec With The Rest Cabernet Sauvignon, Merlot And Petit Verdot, This Wine Shows The Oak Up Front, With Dill And Vanilla Leading Over Plum And Green Herbs. The Fruit Flavors Are Plump And Generous Backed By Vibrant Acidity. Barrel Notes Linger On The Finish.",Bona Vita,,,,,,
803,,"Brighter And Fresher Than Usual For This Varietal, This Shows Green Apple, Lime, Lemon And Melon Aromas And Flavors. With A Tangy, Refreshing Balance, Medium Body And Crisp Texture, It Is Fun And Refreshing To Drink.",Buttner Vineyard,,,,,Las Positas,
804,,"This Straightforward Wine From The Riboli Family Portfolio Goes Down Very Easy, Making It Perfect For Backyard Barbecues. Cherries, Dried Rose Petals And Anise Greet The Nose. The Palate Isn't Too Complex, But Delivers Dark Red Fruits And Pepper Spices.",,,,,,Maddalena,
805,,"There Are A Lot Of Varieties In This Blend, From Merlot, Which Makes Up The Majority, To Handfuls Of Syrah, Zinfandel And Petit Verdot. Sizable Tannins Wrap Themselves Around Flavors Of Tobacco, Juicy Plum And Oaky Vanilla, Finishing Dry And Ripe.",Cellar 1879 Blend,,,,,Markham,
806,,"While The Nose Is Delicate With Faint Hints Of Yellow Plum And Pear, The Palate Is Surprisingly Brawny And Bold. Rich, Buttery And Voluminous, This Wine Showcases Ripe Citrus And Apple Flavors, But Falls A Bit Short On The Finish.",,,,,,Rooster Hill,
807,,"While Delicately Framed For Its Variety, This Gewürztraminer Is Concentrated With Sunny Tangerine And Peach Flavors. Delicate Hints Of Smoke, Spice And Blossom Accent The Midpalate And Linger On The Finish.",,,,,,,
808,,"This Affordable, Estate-vineyard 100% Cabernet Sauvignon Is Chewy In Robust Tar And Leather, With Companionable Characteristics Of Cranberry And Herb. The Acidity Is High-toned And The Oak Profile Restrained.",Block 007 Estate Vineyard,,,,,Pedroncelli,
809,,"Although Light, This Well-balanced Wine Has Good Depth. A Dry Core Of Tannins Backs Up The Bright Red Berry And Black Currant Fruits. Acidity And The Tannins Promise Some Aging, Although The Wine Is Drinkable Now.",Mission St Vincent Réserve,,,,,Producta Vignobles,Bordeaux
810,,,,,,,,,
811,,,,,,,,,
812,,,,,,,,,
813,,,,,,,,,
814,,,,,,,,,
815,,,,,,,,,
816,,,,,,,,,
817,,,,,,,,,
818,,,,,,,,,
819,,,,,,,,,
820,,,,,,,,,
821,,,,,,,,,
822,,"This Is A Sanguine, Full-bodied And Nearly Jammy Wine, Rich And Plush In Black And Red Fruit And A Curious Twist Of Beef Jerky. Cedar And Cranberry Provide A Crisper, More Classical Edge Burnished On The Palate In Leathery Black Pepper.",Circle S Vineyard,,,,,Tetra,
823,,"From 100% Estate-grown Grapes, And Possessing 6.8 G/l Of Residual Sugar, This Wine Is Lovely In Peach, Pear And Lemon, And Quite Voluptuous In Texture, With A Hint Of Spice. Pretty Floral Aromas Of Jasmine Provide Additional Flourish And Invitation, With The Finish Dry.",,,,,,Trefethen,
824,,"Enticing Scents Of Cherry Blossom, Spanish Broom, Crushed Rock And Mediterranean Herb Lift Out Of The Glass. The Vibrant, Tangy Palate Offers Succulent Nectarine, Wild Cherry, Crushed Strawberry And Mineral Alongside A Backbone Of Lively Acidity.",Rosato,,,,Nerello Mascalese,Girolamo Russo,
825,,"The Dead Arm Is Always Firmly Structured, Making It One Of The More Challenging Shiraz To Judge In Its Youth. The 2010 Is Full-bodied And Chewy, Characterized By Dark, Earthy And Umami Notes Of Roasted Meat, Asphalt And Grilled Mushrooms. The Length And Ripely Tannic Nature Of The Finish Is Reassuring. Drink 2018–2030.",The Dead Arm,,,,Shiraz,D'arenberg,Mclaren Vale
826,,Chocolate And Blackberry Form An Impressively Generous And Full-bodied Personality In This 100% Varietal Wine Aged 22 Months In A Hearty Percentage Of New Oak. Big Tannin And Traces Of Cigar And Espresso Continue On The Brawny Theme.,,,,,,Herencia,
827,,"An Earthy Wine That Offers Complexity Around A Full-bodied Juiciness Of Blackberry And Bitter Black Tea, This Is Made In A Big Style And Will Appeal To Fans Of Concentration And Decisive Use Of Oak.",Symphonia,,,,,Levendi,
828,,"Opulent Blackberry Aromas And A Mouthful Of Jammy, Grapey But Dry Fruit Flavors Put A Lot Of Oomph Into This Focused, Concentrated And Well-balanced Wine. It Is Just Tart And Tannic Enough To Pair Easily With Rich Food, And Those Same Qualities Should Help It Mellow With Age Through 2020.",,,,,Negroamaro,Monte Volpe,
829,,"This Full-bodied And Densely Textured Wine Has A Deep Color, Aromas Like Wood Smoke And Blackberries, And Flavors That Saturate The Palate With Berries, Clove And Dark Chocolate Notes. It's Bold In Body, Has Plenty Of Tannins For Grip, And A Lingering, Rich Finish.",,,,,,Morse,
830,,"A Winning Combination Of Seductive, Spicy Aromas And Generous, Well-developed Fruit Flavors Make This Wine Hard To Resist. It Is Full-bodied, Dry And Quite Full-flavored, But Without Overdoing Anything, So It's Well Balanced.","Estate Grown, Produced And Bottled",,,,,Naggiar,
831,,"Allowing Zinfandel To Take The 60% Lead In This Marriage With Cabernet Sauvignon, This Is An Impressive Mingling Of The Two. Black Pepper, Clove And Leathery Cigar Fuel A High-powered Succulence Of Black And Red Fruit Accented By A Smoky Drawl.",Howell Mountain,,,,,,
832,,"Generous Fruit And Spice Flavors And A Full, Chewy Mouthfeel Make This An Appetizing Wine To Pair With Big Food. It Smells Like Black Cherries, Tastes Ripe And Berry-like And Has Accents Of Cinnamon And Cardamom. The Texture Is Supportive And Lightly Astringent, With Fine Tannins.",,,,,,,
833,,"Spicy, Herbal Plum And Cassis Aromas Mix In Notes Of Olive And Wet Dog Fur. This Is More Spunky And Fresh Than Dense. Leafy Berry, Plum And Olive Are The Key Flavors On This Carmenère-led Blend That Finishes Herbal And Spicy, With High-toned Residual Acidity.",Amplus One,,,Peumo,,Santa Ema,
834,,"Smoky, Oaky, Charred Flavors Of Savory Plum And Berry Lead To A Full, Layered Palate With Slightly Abrasive Tannins. This Tastes Of Grilled Beef, Lemon Peel, Toast, Cassis And Chocolate. A Toasted Character Remains On A Solid Finish. Drink Through 2020.",,,,,,Beronia,
835,,"Dried Purple Flowers And Dark Cardamom Spices Are Layered Across Aromas Of Blackberry, Roast Beef, Soy, Jerky And Peppercorn On The Nose Of This Blend Of 52% Syrah, 40% Mourvèdre And 8% Grenache. A Solid, Nearly Chewy Structure Unveils Dark Flavors Of Beef Char, Pencil Lead, Blueberries And A Touch Of Asphalt.",Version Red Anna's Vineyard Reserve,,,,,Adelaida Cellars,
836,,"Aromas Of Gingerbread Cookies With A Black-cherry Glaze Meet Black Gravel And A Touch Of Asphalt On The Nose Of This Complex And Flavorful Bottling. The Palate Blends The Brightness Of Red Cherry And Strawberry Fruit With A Rocky Minerality, Spiced Up By Black Pepper And Settling Into A Plum-skin Groove Toward The Finish.",Bailey Ranch Riserva,,,,,Bella Luna,
837,,"While Relatively Full-bodied And Tannic, This Wine Also Has Friendly, Fresh Berry And Cherry Flavors That Are Held In Place By Very Firm Acidity And Tannins. It Feels And Tastes Generous But Also Strong And Taut, So It Should Improve With A Little Time. Best To Drink Now Through 2020.",,,,,,,
838,,"A Dusting Of Crushed Slate And Saffron Accents This Zesty Lime And Honey Kissed Kabinett. It's Dancingly Light On The Palate, But Concentrated With Swirls Of Marmalade And Orange-peel Flavors That Extend Through A Long Finish. Drink Now Through 2025.",Thanisch Kabinett,,,,,,
839,,"Aromas Like Mint, Dried Cherry And New Oak Complement Bright, Ripe Fruit Flavors In This Full-bodied, Densely Textured Wine. It Has A Lip-smacking Freshness, Lively Tannins, A Lot Of Complexity And A Lingering Finish.",,,,,,,
840,,,,,,,,,
841,,,,,,,,,
842,,"Fresh Whiffs Of Strawberry And Blossom Go Hand-in-hand With More Evolved Complexities Of Mushroom And Yeast In This Invigorating Rosé Sparkling. While Delicately Moussed, It's Pinot-noir Heavy Blend Lends A Satisfyingly Voluminous Feel To The Palate.",Topaz Impérial Rosé,,,,Champagne Blend,Sparkling Pointe,North Fork Of Long Island
843,,"Oak And Spice Components Fill The Aroma. The Flavors Are Rich And Concentrated, Making This A Big Yet Seductive Wine. Layered And Complex, This Full-bodied Wine Is Well Supported By Fine, Velvety Tannins.",Stymie Founder's Reserve,,,,,Steele,Lake County
844,,"Bready White-fruit Aromas Are A Touch Funky And Difficult To Gauge. In The Mouth, This Is Foamy But Secure, With Lemon-lime And Nectarine Flavors. This Feels Precise On The Finish, With Mild Yeast And Bread Flavors.",Brut Reserva Special Edition,,,,,Torelló,
845,,"From The Producer's Main Ranch And Blended With 11% Malbec And 4% Merlot, This Classically Structured, Crisp Wine Offers Notes Of Thyme, Blackberry And Tar. Medium Bodied On The Palate, It Finishes In Juicy Cassis And Will Stand Up To Cellaring. Drink Now Through 2020.",,,,,,,
846,,"Dried Cherry And Strawberry Notes Are Marked By A Hint Of Anise On The Nose Of This Lush, Velvety Pinot Noir. While Delicate In Frame, Ripe Berry And Cherry Flavors Build In Concentration On The Palate, Accentuated By A Spray Of Pomegranate Acidity And Lingering Bramble Notes.",,,,,,Anthony Road,
847,,"Brilliantly Fresh, This Wine Is Tight With Acidity And Textured With Zingy Citrus. Layers Of Apple And Toast Are Already Integrated In This Bright Wine. It's Tangy, Lively And Likely To Be Ready To Drink From 2017. The Wine Comes From The Highest Vineyard In Chassagne.",En Pimont,,,,,Au Pied Du Mont Chauve,
848,,"Produced From The Rare Romorantin Grape, This Wine Is Honeyed As Well As Crisp And Fragrantly Fruity. The 50-year-old Vines Give Extra Concentration To This Lightly Wood-aged Wine That Is Ripe While Also Light And Poised. Drink Now, Although It Would Be Better To Keep It Until 2017.",,,,,Romorantin,Benoît Daridan,Cour-cheverny
849,,"Part Of The Same Family Business As Philippe Girard's Wines (benoît Is His Brother), This Is A Ripe, Pure And Clean Wine. Perfumed Acidity And Zesty Flavors Are Integrated Into The Rich Green Fruit. Apples And Green Plums Dominate This Refreshing Wine That Will Develop. Drink From 2017.",,,,,,Benoît Girard,
850,,"This Is A Spicy, Earthy And Medium-bodied Selection, Lengthy And Concentrated In Cardamom And Forest Pine. The Fruit Tends Dark And Brooding, With A Brambly Character Balanced Against The Crispness Of Acidity. The Spiciness Persists Through The Finish.",Geza's Selection,,,,,Buena Vista,
851,,"Smooth And Engaging, This Offers Classic Varietal Flavors In The Context Of A Northern Climate. Red Licorice, Coffee, Tobacco, Hemp And Dried Herbs Are All In The Mix, With Some Fruit Leather And Hints Of Violets.",,,,,,Burrowing Owl,
852,,"Black Cherry, Red Raspberry, Dried Violets And Graphite Scent This Thracian Valley Syrah. It Is Full Bodied, Tasting Of Blueberry Preserves, Black Cherry And Espresso Beans. The Tannins Are Soft And Round And Lead To An Elegant Finish.",Nimbus Premium,,,,,Castra Rubra,
853,,"Produced From Two Parcels In Aloxe Corton, This Structured Wine Has Red-plum Fruitiness That Is Still Masked By A Dry Tannic Coating. It Has Concentration And Good Potential. Drink This Textured, Firm Wine From 2018.",Les Brunettes Et Planchots,,,,,Château De Santenay,Aloxe-corton
854,,"This Wine Is Packed With Ripe Fruit, Fresh Acidity And Crisply Textured Minerality. Finely Wrought, It's Structured And Made To Age, With A Strong Steely Backbone To The Otherwise Fresh Lemon And Lime Flavors. Drink From 2018.",,,,,,Château Favray,
855,,"Damp Sagebrush, Dark Cranberry, Buttered Black Cherries, Fresh Plucked Marjoram And Wet Stone Show On The Nose Of This Bottling. The Tip Of The Sip Shows Great Thyme, Bay Leaf And Anise Character, Then Settles Into Rich Cranberry Fruit, All Held Together By A Decent Tannic Grip. The Dark Fruit Flavors Linger Deep In The Finish.",The Diva,,,,,Chateau Lettau,
856,,"This Offers Aromas Suggesting Forest Floor, Porcini Mushroom, Grilled Herb, Leather And Mature Berry. The Ripe, Chewy Palate Displays Black Cherry, Sage, Licorice And Toasted Nut Alongside Tightly Wound Tannins That Need To Unwind. 2018–2024.",,,,,,,
857,,,,,,,,,
858,,"Dusty Apple And Mineral Aromas Are Composed, Not Loud, While Additional Peach-pit Notes Are Crisp. This Mature Godello Is Round And Solid In Composition, While Stony Apple And Quince Flavors Finish Long And In Good Shape. Drink Now.",Lapola,,,,,Dominio Do Bibei,
859,,,,,,,,,
860,,,,,,,,,
861,,,,,,,,,
862,,"Wild Cherry, Rose, Spice And Chopped Sage Aromas Come Together On This Round, Savory Wine. The Juicy Palate Offers Fleshy Black Cherry, Raspberry, Star Anise And A Coffee Note Set In A Framework Of Polished Tannins. Drink Through 2018.",,,,,,Luiano,
863,,"A Blend Of 85% Sangiovese, 10% Colorino And 5% Canaiolo, This Offers Pretty Aromas Of Pressed Rose, Violet, Berry, Menthol And A Whiff Of Ground Cooking Spice. The Linear Palate Offers Mature Black Cherry, Orange Zest, Clove, White Pepper, Licorice And A Hint Of Pipe Tobacco Alongside Firm, Fine-grained Tannins.",,,,,,Villa Mangiacane,
864,,"Black Fruits, Fine Herbs And Horsehide Carry The Aromas Of This Offering. In The Mouth, This Is Firm And Well Built, With Integrated Tannins. Savory Flavors Of Soy Sauce And Roast Plum Share Space With Bolder, Riper Cherry Notes, While A Warm, Earthy Finish Tastes Of Roasted Plum And Berry. Drink Through 2021.",Valcortes Crianza,,,,,Maset Del Lleó,
865,,"Mostly Sangiovese With 5% Colorino And Made By Refermenting With Partially Dried Grapes, This Wine Offers Aromas Of Dried Plum, Clove, Scorched Earth And A Balsamic Note. The Concentrated Palate Offers Dried Black Cherry, Raisin, Licorice And A Note Of Ground Pepper That Lead To A Firm Finish.",,,,,,Salcheto,
866,,"Luminous And Fresh, This Opens With Aromas Of Red Berry, Violet, Chopped Herb And A Whiff Of Baking Spice. The Vibrant, Linear Palate Offers Red Cherry, Strawberry, White Pepper And Star Anise Alongside Racy Acidity And Polished Tannins. Enjoy Through 2018.",,,,,,,
867,,"Pressed Violet, Perfumed Berry And A Hint Of Baking Spice Aromas Unfold On This Sleek, Savory Red. The Medium-bodied Palate Delivers Ripe Black Cherry, Crushed Raspberry, Cinnamon, Clove And Star Anise Alongside Firm, Polished Tannins. Drink Through 2021.",Il Palei,,,,,Villa A Sesta,
868,,"Red Berry, Chopped Herb, Blue Flower And Menthol All Come Together On This Elegantly Structured Red. The Juicy, Accessible Palate Offers Ripe Black Cherry, Crushed Raspberry, Licorice And A Hint Of Vanilla Alongside Round Tannins. Drink Through 2021.",,,,,,Castello Della Paneretta,
869,,"A Dark Nose Of Black Tobacco, Condensed Violets, Soy, Black Pepper, Black Plum And Aromatic Wood Shows On The Nose Of This Wine From A Longtime Paso Estate, Now Owned By The Foley Family. The Palate Offers An Intriguing Sense Of Black Pepper And Dried Violets, Followed By Lavender, Thyme, Rosemary And Elderberry Laid Across Fine-grained But Structured Tannins.",,,,,,,
870,,,,,,,,,
871,,,,,,,,,
872,,,,,,,,,
873,,,,,,,,,
874,,"An Enticing Fragrance Of Rose, Blue Flower, Incense And Truffle Wafts Out Of The Glass. On The Palate, Accents Of Black Pepper, Espresso And Licorice Add Depth To The Bright Cherry-berry Fruit, While Polished Tannins Give It A Smooth, Silky Texture. It's Well Balanced And Fresh. Drink 2018–2030.",Maria Di Brun,,113.0,,,Ca'romè,
875,,"Pure Fruitiness With A Deliciously Tangy Texture Mark This Wine. It Has A Rich, Juicy Character With Light Spice To Highlight The Green Fruits And Zesty Bitter Orange Flavor. At The Moment, The Wine Is All Fruit And It Needs To Age To Bring Out The Greater Depth. Drink From 2017.",Vignoble D'e,,,,,,
876,,"Sweet Oak, Vanilla, Plum, Violet And Mocha Aromas Lead The Nose On This Structured Wine. The Oak Influence Carries Over To The Palate Together With Ripe Black Cherry, Leather And Baking Spice. The Tightly Compacted Tannins Need Time To Unwind. Drink 2020–2035.",Vigna Del Gris,,,,,Conterno Fantino,
877,,"Underbrush, Tobacco Leaf, Leather, Truffle And Blackberry Aromas Take Center Stage Along With Whiffs Of Toast And Fig. The Palate Shows Black Cherry, Carob, Bitter Cocoa, White Pepper And Sage Alongside Bracing Tannins That Leave A Drying Finish.",Leon Riserva,,,,,Rivetto,
878,,"A Brand New Vineyard Designation For The Winery, Bedrock Dates To The 1800s And Is Being Made Famous By Proprietor Joel Peterson Of Ravenswood And His Son, Morgan Twain Peterson. This Wine Does The Site Justice, A Smooth Concoction Of Cherry Pit And Allspice, Elegant And Yet Plenty Generous In Fruit And Structure, Measured By Natural Acidity.",Bedrock Vineyard,,,,,,
879,,"Buttered Sourdough Toast And A Slight Nuttiness Kick Off Another Excellent Chardonnay From The Ever-reliable Talley. The Palate Is Greeted With Minerality That Fades Into An Apple Butter Flavor Alongside A Pinch Of Cinnamon, Culminating In A Graceful Vanilla Finish.",,,,,,Talley,
880,,"Made Entirely Of Pinot Nero, This Elegant, Structured Sparkler Opens With Aromas Of Rose, Berry And Yeasty Sensations Of Freshly Baked Butter Cookies. The Palate Delivers A Nice Depth Of Flavors Including Tart Red Apple, Wild Strawberry, Sage And Marjoram Alongside Brisk Acidity And An Elegant, Persistent Mousse. It's Already Delicious But Will Also Age Well Over The Next Few Years. Drink Through 2019.",Cuvée Giulio I,,,,,Tosti,Alta Langa
881,,"Fresh And Refined, This Has An Intensely Fruity Nose Of Wild Berry, Forest Floor, Pine And Rose Petal. The Bright Palate Doles Out Crushed Strawberry, Morello Cherry, Vanilla And Cinnamon Alongside Smooth, Supple Tannins And Bright Acidity. Nicely Balanced And Focused. Drink Through 2025.",,,,,,Veglio,
882,,"This Lightly Wood-aged Wine Is Slightly Austere In Style, With Plum And Blackberry Tones Providing Weight. Some Tannins And Acidity Accompany Its Fine, Fruity Core, Giving A More Serious Note To This Wine. Drink From 2018.",Seleção Do Enólogo,,,,,Pedra Cancela,
883,,"Still Dark And Dense, This Young Wine Has Power And Structure On Its Side. The Tannins And Concentrated Firm Texture Promise Aging, Allowing The Big Black Fruits To Be Released. Made From Vines In The Douro Superior; Drink From 2017.",Vale De Cavalos,,,,,,
884,,"The Wine Is Crisp, Packed With Grapefruit Flavors And With A Tight Texture That Suggests It Could Age. A Tang And A Steely Acidity Comes In Behind The Fruit And Offers An Austere Aftertaste. Drink From 2017.",Schlossberg Grand Cru,,,,,Joseph Fritsch,
885,,"A Stellar Wine At Kiona For Decades, This Includes 11% Gewürztraminer In The Blend, And Is Finished At 83 G/l Residual Sugar. The Palate Impression Is More Juicy Than Sweet, With Rich Fruit Flavors Of Ripe Grapefruit, Peach And Apricot. The Balance, Acidity, Length And Texture Are Spot On.",Late Harvest,,,,,Kiona,
886,,"Jet-black Aromatics Of Creosote, Charred Meats, Pepper And Plum-blackberry Jam Make An Excellent Entry Point For This Wine From A Vineyard In The New Ballard Canyon Appellation. Blackberry Sauce Leads The Palate, With Espresso Bitterness And Strong Acidity Throughout. A Powerful But Beautiful Syrah.",Tierra Alta Vineyard,,,,,,
887,,"Lightly Toasted Tobacco, Blueberry Pie And Cedar Scents Lead The Way On This Single-vineyard Cab. Fresh Blueberry On The Palate Combines With A Great Arc Of Flavors That Ends In A Chewed Cigar Finish.",Lone Oak Vineyard Estate,,,,,Cooper-garrod,
888,,"Pure Merlot From The Stillwater Creek Vineyard, This Finished Its Fermentation In Concrete Egg, Then Spent 20 Months In 100% New French Oak, And Another Two Years In Bottle Prior To Release. Tightly Wound And Dense With Cherry And Chocolate Layered Throughout, It Brings In Flavors Of Red Licorice And Baking Spices. The Tannins Are Silky And The Structure And Flavors Are Bold.",,,140.0,,,Matteo,
889,,"Many Red Wines From Epiphany, Run By The Family Of The Late Actor Fess Parker, Have A Nose-tickling Singed-cedar Aroma. It Works Great On This Blend Of 57% Syrah And 43% Cabernet Sauvignon, Leading Into A Palate Heavy With Espresso And Dark Chocolate-dipped Cherries, Culminating In A Mocha Finish.",,,,,Syrah-cabernet Sauvignon,,
